{
  "$schema": "http://json-schema.org/draft-07/schema#",
  "$id": "https://example.com/prizepacks-schema.json",
  "title": "Prizeler Prize Packs File Schema",
  "description": "JSON schema for validating prize pack data files - array of prize pack records",
  "type": "array",
  "items": {
    "type": "object",
    "properties": {
      "pack": {
        "type": "string",
        "minLength": 1,
        "maxLength": 200,
        "description": "Unique prize pack identifier / Inventory Number"
      },
      "block": {
        "type": "string",
        "minLength": 1,
        "maxLength": 200,
        "description": "Block or category name for the prize pack"
      },
      "blockName": {
        "type": "string",
        "minLength": 1,
        "maxLength": 200,
        "description": "Display name for the prize pack"
      },
      "startDate": {
        "type": "string",
        "pattern": "^\\d{4}-\\d{2}-\\d{2}[ T]\\d{2}:\\d{2}:\\d{2}$",
        "description": "Timestamp when the prize pack becomes available (YYYY-MM-DD HH:MM:SS or YYYY-MM-DDTHH:MM:SS)"
      },
      "endDate": {
        "type": "string",
        "pattern": "^\\d{4}-\\d{2}-\\d{2}[ T]\\d{2}:\\d{2}:\\d{2}$",
        "description": "Timestamp when the prize pack ends (YYYY-MM-DD HH:MM:SS or YYYY-MM-DDTHH:MM:SS)"
      },
      "itemDescription": {
        "type": "string",
        "minLength": 1,
        "maxLength": 500,
        "description": "Description of the prize items included in the pack"
      },
      "minEntryDollars": {
        "type": "number",
        "minimum": 0,
        "description": "Minimum donation amount required for entry (in dollars, supports cents)"
      },
      "multientry": {
        "type": "boolean",
        "description": "Whether multiple entries are allowed based on donation amount"
      },
      "draws": {
        "type": "integer",
        "minimum": 1,
        "maximum": 100,
        "description": "Number of winners to draw for this prize pack"
      }
    },
    "required": ["pack", "block", "blockName", "startDate", "endDate", "itemDescription", "minEntryDollars", "multientry", "draws"],
    "additionalProperties": false
  },
  "minItems": 0
}
