[
  {
    "pack": "B-01",
    "block": "Grand Prize",
    "blockName": "Switch 2",
    "startDate": "2025-06-09T18:00:00.000Z",
    "endDate": "2025-06-15T11:00:00.000Z",
    "itemDescription": "Switch 2, Amiibo x4",
    "minEntryDollars": 100,
    "multientry": false,
    "draws": 1
  },
  {
    "pack": "B-10",
    "block": "Grand Prize",
    "blockName": "Tears of the Kingdom Mural Woodcut",
    "startDate": "2025-06-09T18:00:00.000Z",
    "endDate": "2025-06-15T11:00:00.000Z",
    "itemDescription": "TOTK Mural",
    "minEntryDollars": 200,
    "multientry": false,
    "draws": 1
  },
  {
    "pack": "B-02",
    "block": "WW Mutiny",
    "blockName": "Planning a Mutiny",
    "startDate": "2025-06-09T20:00:00.000Z",
    "endDate": "2025-06-09T16:50:00.000Z",
    "itemDescription": "Bottled Fairy Pillow, Link PJs Hat, Tetra's Amulet Drawing",
    "minEntryDollars": 10,
    "multientry": false,
    "draws": 1
  },
  {
    "pack": "B-03",
    "block": "WW Mutiny FG",
    "blockName": "PWING",
    "startDate": "2025-06-09T13:00:00.000Z",
    "endDate": "2025-06-10T02:00:00.000Z",
    "itemDescription": "Crocheted Swift Sail",
    "minEntryDollars": 10,
    "multientry": true,
    "draws": 1
  },
  {
    "pack": "B-41",
    "block": "Minish Cap",
    "blockName": "Minish Cap Grab Bag",
    "startDate": "2025-06-09T16:50:00.000Z",
    "endDate": "2025-06-09T18:55:00.000Z",
    "itemDescription": "Green Rupee Keychain, Hylian crest fingerless gloves, 3 corrupted master sword stickers",
    "minEntryDollars": 5,
    "multientry": false,
    "draws": 1
  },
  {
    "pack": "B-24",
    "block": "HWAOC:GP",
    "blockName": "Girlypop Garden Party",
    "startDate": "2025-06-09T18:55:00.000Z",
    "endDate": "2025-06-10T11:10:00.000Z",
    "itemDescription": "Three floral keychains with Ganondorf/Zelda/Link, Master sword enamel pin with silent princess",
    "minEntryDollars": 10,
    "multientry": false,
    "draws": 1
  },
  {
    "pack": "B-22",
    "block": "HWAOC:GP FG",
    "blockName": "Girlypop Glam",
    "startDate": "2025-06-10T20:00:00.000Z",
    "endDate": "2025-06-10T09:00:00.000Z",
    "itemDescription": "Three sets of earrings and pendant",
    "minEntryDollars": 5,
    "multientry": true,
    "draws": 1
  },
  {
    "pack": "B-08",
    "block": "CD-i block",
    "blockName": "Saturday Morning Cartoon",
    "startDate": "2025-06-10T11:10:00.000Z",
    "endDate": "2025-06-10T14:25:00.000Z",
    "itemDescription": "tloz tv.series",
    "minEntryDollars": 5,
    "multientry": false,
    "draws": 3
  },
  {
    "pack": "B-09",
    "block": "CD-i block FG",
    "blockName": "Don't Knock It 'Til You Try It",
    "startDate": "2025-06-10T12:20:00.000Z",
    "endDate": "2025-06-10T13:20:00.000Z",
    "itemDescription": "Arzette Collectors Edition and controller",
    "minEntryDollars": 5,
    "multientry": false,
    "draws": 1
  },
  {
    "pack": "B-04",
    "block": "Oracle Shuffler",
    "blockName": "Oracle of Art",
    "startDate": "2025-06-10T14:25:00.000Z",
    "endDate": "2025-06-10T21:15:00.000Z",
    "itemDescription": "Four framed mini cross stitches, Two Linktober sketch books x2 (Oracle themed)",
    "minEntryDollars": 10,
    "multientry": false,
    "draws": 1
  },
  {
    "pack": "B-06",
    "block": "Echoes of Wisdom",
    "blockName": "Friend-Shaped",
    "startDate": "2025-06-10T21:15:00.000Z",
    "endDate": "2025-06-11T06:45:00.000Z",
    "itemDescription": "Felted Tri",
    "minEntryDollars": 10,
    "multientry": false,
    "draws": 1
  },
  {
    "pack": "B-07",
    "block": "Echoes of Wisdom",
    "blockName": "Speak Softly and Carry a Big Stick",
    "startDate": "2025-06-11T00:15:00.000Z",
    "endDate": "2025-06-11T01:15:00.000Z",
    "itemDescription": "TriRod",
    "minEntryDollars": 10,
    "multientry": true,
    "draws": 1
  },
  {
    "pack": "B-23",
    "block": "WMGSO'S Wonderful Woodwind Water Wheel / 2D Shuffler Gauntlet",
    "blockName": "Water and Fire Do Mix?",
    "startDate": "2025-06-11T06:45:00.000Z",
    "endDate": "2025-06-11T09:05:00.000Z",
    "itemDescription": "Four Candles",
    "minEntryDollars": 10,
    "multientry": false,
    "draws": 1
  },
  {
    "pack": "B-26",
    "block": "Metal Gear Solid",
    "blockName": "Sneaky Snake",
    "startDate": "2025-06-11T09:05:00.000Z",
    "endDate": "2025-06-11T12:20:00.000Z",
    "itemDescription": "Cardboard Box Snake Stickers",
    "minEntryDollars": 3.31,
    "multientry": false,
    "draws": 3
  },
  {
    "pack": "B-13",
    "block": "Phantom Hourglass",
    "blockName": "Steamboat Winning",
    "startDate": "2025-06-11T12:20:00.000Z",
    "endDate": "2025-06-12T08:40:00.000Z",
    "itemDescription": "Linebeck Drawing, Bottled Fairy Pillow, Valoo Poster, Zelda Creators Sticker Sheet",
    "minEntryDollars": 3.31,
    "multientry": false,
    "draws": 1
  },
  {
    "pack": "B-18",
    "block": "Phantom Hourglass FG",
    "blockName": "The Hero of Wind(ow)s",
    "startDate": "2025-06-11T18:20:00.000Z",
    "endDate": "2025-06-11T19:20:00.000Z",
    "itemDescription": "Stained Glass",
    "minEntryDollars": 10,
    "multientry": true,
    "draws": 1
  },
  {
    "pack": "B-17",
    "block": "OOT 37 WTK / Four Swords Co-op",
    "blockName": "OoT/Four Swords Grab Bag",
    "startDate": "2025-06-12T08:40:00.000Z",
    "endDate": "2025-06-11T23:50:00.000Z",
    "itemDescription": "Valoo Poster, Zelda Creators Sticker Sheet, Linktober Four Swords Art Book, Linktober OOT Art Book, Master Sword Sticker, Hylian Shield Sticker, ",
    "minEntryDollars": 5,
    "multientry": false,
    "draws": 1
  },
  {
    "pack": "B-12",
    "block": "LA Speed Run",
    "blockName": "Wow, Bow Wow!",
    "startDate": "2025-06-11T23:50:00.000Z",
    "endDate": "2025-06-12T01:05:00.000Z",
    "itemDescription": "BowWow print, BowWow mousepad",
    "minEntryDollars": 5,
    "multientry": false,
    "draws": 1
  },
  {
    "pack": "B-16",
    "block": "Navi Trackers",
    "blockName": "Mom's Portrait",
    "startDate": "2025-06-12T01:05:00.000Z",
    "endDate": "2025-06-12T03:15:00.000Z",
    "itemDescription": "Captain Trina Framed Cross Stitch",
    "minEntryDollars": 5,
    "multientry": false,
    "draws": 1
  },
  {
    "pack": "B-29",
    "block": "TOTK  Nature Documentary (Part 2)",
    "blockName": "The Tea-OTK",
    "startDate": "2025-06-12T03:15:00.000Z",
    "endDate": "2025-06-12T05:30:00.000Z",
    "itemDescription": "Link Armor stickers (3 styles), Earthenware TOTK mug, Master sword enamel pin",
    "minEntryDollars": 10,
    "multientry": false,
    "draws": 1
  },
  {
    "pack": "B-30",
    "block": "WindWaker Bingo / Z1 Speedrun",
    "blockName": "Pwing-O!",
    "startDate": "2025-06-12T05:30:00.000Z",
    "endDate": "2025-06-12T20:50:00.000Z",
    "itemDescription": "Makar plush, Korok Print, Linktober Art book Windwaker, Linktober Art book Zelda 2",
    "minEntryDollars": 10,
    "multientry": false,
    "draws": 1
  },
  {
    "pack": "B-44",
    "block": "Twilight Princess ",
    "blockName": "Old Dog, New Tricks",
    "startDate": "2025-06-12T20:50:00.000Z",
    "endDate": "2025-06-12T16:00:00.000Z",
    "itemDescription": "Heroes Shade print, Fairy Bottle Pillow, Hylian Shield Fingerless Gloves",
    "minEntryDollars": 10,
    "multientry": false,
    "draws": 1
  },
  {
    "pack": "B-21",
    "block": "Twilight Princess FG",
    "blockName": "It's Dangerous To Go Alone",
    "startDate": "2025-06-12T10:50:00.000Z",
    "endDate": "2025-06-12T11:50:00.000Z",
    "itemDescription": "Underworld Dungeon Shadow Box",
    "minEntryDollars": 10,
    "multientry": true,
    "draws": 1
  },
  {
    "pack": "B-20",
    "block": "Tingle's Rosy Rupeeland / Damage Shuffler",
    "blockName": "Lullaby and Goodnight - Cozy Quilt",
    "startDate": "2025-06-12T16:00:00.000Z",
    "endDate": "2025-06-13T08:00:00.000Z",
    "itemDescription": "Zelda Quilt",
    "minEntryDollars": 10,
    "multientry": false,
    "draws": 1
  },
  {
    "pack": "B-42",
    "block": "Tingle's Rosy Rupeeland FG",
    "blockName": "Fun Finn",
    "startDate": "2025-06-12T16:45:00.000Z",
    "endDate": "2025-06-12T17:00:00.000Z",
    "itemDescription": "Finn Plushie Customized",
    "minEntryDollars": 5,
    "multientry": true,
    "draws": 1
  },
  {
    "pack": "B-25",
    "block": "Link to the Pianist",
    "blockName": "Jam Time",
    "startDate": "2025-06-12T20:00:00.000Z",
    "endDate": "2025-06-12T22:30:00.000Z",
    "itemDescription": "30th Anniversary CD",
    "minEntryDollars": 10,
    "multientry": false,
    "draws": 1
  },
  {
    "pack": "B-35",
    "block": "Triforce Heroes / Zelda Puppet Show",
    "blockName": "Dress the Part",
    "startDate": "2025-06-12T22:30:00.000Z",
    "endDate": "2025-06-13T01:50:00.000Z",
    "itemDescription": "Keaton Mask, Lovers Mask, Linktober Pin, Goddess Patches",
    "minEntryDollars": 5,
    "multientry": false,
    "draws": 1
  },
  {
    "pack": "B-31",
    "block": "Zelda Slots",
    "blockName": "Let's Go Gambling!",
    "startDate": "2025-06-13T01:50:00.000Z",
    "endDate": "2025-06-13T04:15:00.000Z",
    "itemDescription": "Rupee Bag/Rupees",
    "minEntryDollars": 10,
    "multientry": false,
    "draws": 1
  },
  {
    "pack": "B-40",
    "block": "BOTW Dungeons/Music/EOW All Dungeons",
    "blockName": "BotW/Echoes Grab Bag",
    "startDate": "2025-06-13T04:15:00.000Z",
    "endDate": "2025-06-13T09:40:00.000Z",
    "itemDescription": "master sword sticker, hylian shield sticker, master sword enamel pin, gold rupee keychain, chain wallet",
    "minEntryDollars": 5,
    "multientry": false,
    "draws": 1
  },
  {
    "pack": "B-14",
    "block": "Skyward Sword",
    "blockName": "I'm At Soup",
    "startDate": "2025-06-13T09:40:00.000Z",
    "endDate": "2025-06-13T18:15:00.000Z",
    "itemDescription": "Zelda/Loftwing Amiibo, Lumpy Pumpkin Bottle, Gate of Time coasters",
    "minEntryDollars": 10,
    "multientry": false,
    "draws": 1
  },
  {
    "pack": "B-19",